{
  "schema": "dna-premium-expression-plan",
  "version": "2.0",
  "source": {
    "inputMidiSha256": "4428e453d50cc6409922e47899abc06d2be49a0782e7b6f9f0334a979d0dcec3",
    "songMapHash": "02de1496c1b6955d8bc0d0d0c6a6a5e9c44eaa1e5795ace93b7d3cc4e60aba5d",
    "groovePlanHash": "904b4ba11b23aadf32dd069a3e983736abb3d37ca20e35b36e0a526f0dcd136d",
    "trackUid": "trk-afd2be6e213ec34b8cd2",
    "trackNumber": 4,
    "channelNumber": 3,
    "originalSoloFingerprint": {
      "trackUid": "trk-afd2be6e213ec34b8cd2",
      "trackIndex": 3,
      "trackNumber": 4,
      "channelIndex": 2,
      "channelNumber": 3,
      "window": [
        0,
        15350
      ],
      "noteCount": 16,
      "sha256": "2ed4cc84df9a40eea70e92651cbab2bb499c269b4577045021f053fac31f8365"
    }
  },
  "controls": {
    "version": "1.0",
    "trackUid": "trk-afd2be6e213ec34b8cd2",
    "trackNumber": 4,
    "channelNumber": 3,
    "startTick": 0,
    "endTick": 15350,
    "seed": 2424,
    "intensity": 58,
    "profileId": "698.771.685",
    "enabledLayers": [
      "grace",
      "trill",
      "slide",
      "turnaround",
      "third",
      "echo",
      "cc11"
    ],
    "minEvidenceConfidence": 0.9,
    "layerBudgets": {
      "ornament": 24,
      "third": 16,
      "echo": 8
    },
    "allowSharedChannel": false
  },
  "factoryProfile": {
    "profileId": "698.771.685",
    "databaseVersion": "factory-schema3.3-f91c235f676f9d15",
    "sourceProfileHash": "df5aec8b389b8a2e7eeb7f60aba021de97a8b23e839bc23f4c255c30662b9a8f",
    "soundBinding": {
      "bankMsb": 120,
      "bankLsb": 0,
      "program": 64
    },
    "register": {
      "min": 0,
      "max": 127
    },
    "velocityCurve": [
      2,
      54,
      64,
      80,
      100,
      114,
      127
    ],
    "cc11Curve": [
      73,
      95,
      100,
      115,
      115,
      120,
      127
    ],
    "cc11Bounds": [
      73,
      127
    ],
    "smoothingMaxStep": 7,
    "authority": "FACTORY_ONLY",
    "profileHash": "c830c8751c016cd5523595437ea05949a6bd17a2ee227616c0a8c0b77d8ece75"
  },
  "evidence": {
    "authority": "SOFTWARE_TEST_ONLY",
    "evidenceHash": "41af25aa089d912cbf8ed68a96488c2cee6a30f4e49b36cbb64949855073a72e",
    "productionEligible": false
  },
  "phrases": [
    {
      "phraseId": "phrase-001",
      "sectionId": "sec-001",
      "startTick": 0,
      "endTick": 3840,
      "confidence": 0.92,
      "sourceNoteUids": [
        "src-6ca0ded1aded7dbcd505",
        "src-c474fa108ef6d41a86d1",
        "src-f0cb3df23fa83def2c7d",
        "src-b70bf80b05967bcbe402"
      ]
    },
    {
      "phraseId": "phrase-002",
      "sectionId": "sec-002",
      "startTick": 3840,
      "endTick": 7680,
      "confidence": 0.92,
      "sourceNoteUids": [
        "src-3a5690b1f36c0bc01696",
        "src-8f74db3212863e006e2a",
        "src-3b844d0c3de28cc60c63",
        "src-a9558115c13118f311e2"
      ]
    },
    {
      "phraseId": "phrase-003",
      "sectionId": "sec-003",
      "startTick": 7680,
      "endTick": 11520,
      "confidence": 0.92,
      "sourceNoteUids": [
        "src-6e83696fdca5a9ae8ede",
        "src-1a11eaaf7519b8458e2a",
        "src-96651ff1f69b92cab3ec",
        "src-78de6cc62d9647dcf8e5"
      ]
    },
    {
      "phraseId": "phrase-004",
      "sectionId": "sec-004",
      "startTick": 11520,
      "endTick": 15350,
      "confidence": 0.92,
      "sourceNoteUids": [
        "src-4c887bd93706e2ca8c8b",
        "src-a4432b7ab9703ba72183",
        "src-d4589168317656889985",
        "src-a057d8ecde8f11c55754"
      ]
    }
  ],
  "originalNotes": [
    {
      "sourceNoteUid": "src-6ca0ded1aded7dbcd505",
      "onsetTick": 240,
      "durationTick": 240,
      "pitch": 79,
      "velocity": 25,
      "occurrence": 1,
      "immutable": true
    },
    {
      "sourceNoteUid": "src-c474fa108ef6d41a86d1",
      "onsetTick": 1200,
      "durationTick": 240,
      "pitch": 72,
      "velocity": 25,
      "occurrence": 1,
      "immutable": true
    },
    {
      "sourceNoteUid": "src-f0cb3df23fa83def2c7d",
      "onsetTick": 2160,
      "durationTick": 240,
      "pitch": 77,
      "velocity": 25,
      "occurrence": 1,
      "immutable": true
    },
    {
      "sourceNoteUid": "src-b70bf80b05967bcbe402",
      "onsetTick": 3120,
      "durationTick": 240,
      "pitch": 83,
      "velocity": 25,
      "occurrence": 1,
      "immutable": true
    },
    {
      "sourceNoteUid": "src-3a5690b1f36c0bc01696",
      "onsetTick": 4080,
      "durationTick": 240,
      "pitch": 76,
      "velocity": 25,
      "occurrence": 1,
      "immutable": true
    },
    {
      "sourceNoteUid": "src-8f74db3212863e006e2a",
      "onsetTick": 5040,
      "durationTick": 240,
      "pitch": 72,
      "velocity": 25,
      "occurrence": 1,
      "immutable": true
    },
    {
      "sourceNoteUid": "src-3b844d0c3de28cc60c63",
      "onsetTick": 6000,
      "durationTick": 240,
      "pitch": 77,
      "velocity": 25,
      "occurrence": 1,
      "immutable": true
    },
    {
      "sourceNoteUid": "src-a9558115c13118f311e2",
      "onsetTick": 6960,
      "durationTick": 240,
      "pitch": 79,
      "velocity": 25,
      "occurrence": 1,
      "immutable": true
    },
    {
      "sourceNoteUid": "src-6e83696fdca5a9ae8ede",
      "onsetTick": 7920,
      "durationTick": 240,
      "pitch": 79,
      "velocity": 25,
      "occurrence": 1,
      "immutable": true
    },
    {
      "sourceNoteUid": "src-1a11eaaf7519b8458e2a",
      "onsetTick": 8880,
      "durationTick": 240,
      "pitch": 72,
      "velocity": 25,
      "occurrence": 1,
      "immutable": true
    },
    {
      "sourceNoteUid": "src-96651ff1f69b92cab3ec",
      "onsetTick": 9840,
      "durationTick": 240,
      "pitch": 77,
      "velocity": 25,
      "occurrence": 1,
      "immutable": true
    },
    {
      "sourceNoteUid": "src-78de6cc62d9647dcf8e5",
      "onsetTick": 10800,
      "durationTick": 240,
      "pitch": 83,
      "velocity": 25,
      "occurrence": 1,
      "immutable": true
    },
    {
      "sourceNoteUid": "src-4c887bd93706e2ca8c8b",
      "onsetTick": 11760,
      "durationTick": 240,
      "pitch": 76,
      "velocity": 25,
      "occurrence": 1,
      "immutable": true
    },
    {
      "sourceNoteUid": "src-a4432b7ab9703ba72183",
      "onsetTick": 12720,
      "durationTick": 240,
      "pitch": 72,
      "velocity": 25,
      "occurrence": 1,
      "immutable": true
    },
    {
      "sourceNoteUid": "src-d4589168317656889985",
      "onsetTick": 13680,
      "durationTick": 240,
      "pitch": 77,
      "velocity": 25,
      "occurrence": 1,
      "immutable": true
    },
    {
      "sourceNoteUid": "src-a057d8ecde8f11c55754",
      "onsetTick": 14640,
      "durationTick": 240,
      "pitch": 79,
      "velocity": 25,
      "occurrence": 1,
      "immutable": true
    }
  ],
  "layers": [
    {
      "layerId": "layer-grace",
      "layerType": "ORNAMENT",
      "subtype": "grace",
      "priorityTier": "DECORATIVE",
      "removable": true,
      "decision": "ADD",
      "reason": "EVIDENCE_AND_SPACE_CONFIRMED",
      "budget": 24,
      "events": [
        {
          "eventId": "exp-b53fdb7d4b4db9e0ec57",
          "kind": "grace",
          "sourceNoteUid": "src-c474fa108ef6d41a86d1",
          "evidenceId": "240.100.001",
          "reasonCode": "PHRASE_ENTRY_GRACE_CONFIRMED",
          "phraseId": "phrase-001",
          "chordCellIndex": 1,
          "trackUid": "trk-afd2be6e213ec34b8cd2",
          "trackNumber": 4,
          "channelNumber": 3,
          "routing": "SOURCE_SOLO_PREVIEW_LAYER",
          "onsetTick": 1164,
          "durationTick": 36,
          "pitch": 71,
          "velocity": 84,
          "productionEligible": false,
          "eventHash": "198e2ea68e6bf0960ad9f7f255b4069c20d5c94cdce3c59a6320118893dabf81"
        },
        {
          "eventId": "exp-9e1d13e1d648899e3353",
          "kind": "grace",
          "sourceNoteUid": "src-f0cb3df23fa83def2c7d",
          "evidenceId": "240.100.001",
          "reasonCode": "PHRASE_ENTRY_GRACE_CONFIRMED",
          "phraseId": "phrase-001",
          "chordCellIndex": 2,
          "trackUid": "trk-afd2be6e213ec34b8cd2",
          "trackNumber": 4,
          "channelNumber": 3,
          "routing": "SOURCE_SOLO_PREVIEW_LAYER",
          "onsetTick": 2124,
          "durationTick": 36,
          "pitch": 76,
          "velocity": 84,
          "productionEligible": false,
          "eventHash": "6699d15c7cb58a443abccfac3e676d574f71ff1adf37a9dabf26c98b4e2ab9fb"
        },
        {
          "eventId": "exp-7d556ffda1b4da273bc2",
          "kind": "grace",
          "sourceNoteUid": "src-b70bf80b05967bcbe402",
          "evidenceId": "240.100.001",
          "reasonCode": "PHRASE_ENTRY_GRACE_CONFIRMED",
          "phraseId": "phrase-001",
          "chordCellIndex": 3,
          "trackUid": "trk-afd2be6e213ec34b8cd2",
          "trackNumber": 4,
          "channelNumber": 3,
          "routing": "SOURCE_SOLO_PREVIEW_LAYER",
          "onsetTick": 3084,
          "durationTick": 36,
          "pitch": 82,
          "velocity": 84,
          "productionEligible": false,
          "eventHash": "4da66f7d11106cd3ebc989e026ad86e94112fde0a62ff17514190adb30508812"
        },
        {
          "eventId": "exp-12f66c5233e8cc23923e",
          "kind": "grace",
          "sourceNoteUid": "src-3a5690b1f36c0bc01696",
          "evidenceId": "240.100.001",
          "reasonCode": "PHRASE_ENTRY_GRACE_CONFIRMED",
          "phraseId": "phrase-002",
          "chordCellIndex": 4,
          "trackUid": "trk-afd2be6e213ec34b8cd2",
          "trackNumber": 4,
          "channelNumber": 3,
          "routing": "SOURCE_SOLO_PREVIEW_LAYER",
          "onsetTick": 4044,
          "durationTick": 36,
          "pitch": 75,
          "velocity": 84,
          "productionEligible": false,
          "eventHash": "4712c92b8b565e0ffd8a6e7b085cf636c47c094042e67872fe86018c6ea5d3d1"
        },
        {